repro-fse2026/claude/artifacts/fse_posterior_fse_artifact_all/posterior_pareto.csv

context,strategy,level,runs,n,pct_n,median_train_cost,median_pct_cost,median_effective_n_by_cost,median_calibration_ratio,q1_calibration_ratio,q3_calibration_ratio,median_posterior_risk,q1_posterior_risk,q3_posterior_risk,min_posterior_risk,max_posterior_risk,posterior_confidence_area,prior_confidence_area_size,omega_size_baseline,omega_size_over_max,prior_confidence_area_cost,omega_cost_baseline,omega_cost_over_max,posterior_area_per_pct_cost,pareto_count_cost_risk,pareto_empirical_cost_risk,pareto_count_cost_confidence,pareto_empirical_cost_confidence
7z,random,t2,100,600.0,0.008741258741258742,6758145.0,0.008669724489943971,595.0898889897542,0.9918164816495901,0.9600333198663422,1.025306446953861,0.0010416666666666667,0.0003860722610722611,0.0023164335664335664,0.0,0.011844405594405595,0.9983758741258741,0.9983388704318937,3.700369398040859e-05,0.022276223776206572,0.9983252102933916,5.06638324825337e-05,0.030250862112791904,115.15658603498785,0,0,0,0
7z,solverBased,t2,100,600.0,0.008741258741258742,5144860.0,0.0066001127142630315,453.0317367070145,0.7550528945116908,0.5045743412475306,1.1350481897668838,0.023135198135198137,0.0009943181818181817,0.07651515151515151,0.0,0.13486305361305362,0.9591130536130537,0.9983388704318937,-0.039225816818840076,-23.61394172494236,0.9978023510904166,-0.03868929747736294,-17.604858223098535,145.31767791486092,0,0,0,0
7z,divDistBased,t2,100,600.0,0.008741258741258742,6737540.0,0.008643291249296529,593.2755113517138,0.9887925189195229,0.9171742800322248,1.0586368121868412,0.00236013986013986,0.001176427738927739,0.004061043123543123,4.3706293706293706e-05,0.011101398601398601,0.997106351981352,0.9983388704318937,-0.0012325184505417308,-0.7419761072261419,0.9983201055966013,-0.0012137536152493356,-0.7225178039725242,115.36188278539217,0,0,0,0
7z,twise,t2,100,600.0,0.008741258741258742,4281750.0,0.005492867175063216,377.0304028963391,0.6283840048272319,0.6283840048272319,0.6283840048272319,0.000641025641025641,0.000641025641025641,0.000641025641025641,0.000641025641025641,0.000641025641025641,0.9993589743589744,0.9983388704318937,0.001020103927080629,0.6141025641025551,0.9973616892144836,0.0019972851444907125,0.7570317930151729,181.9375824152298,0,1,0,1
7z,SRSSampling,t2,100,600.0,0.008741258741258742,11695505.0,0.015003644657041564,1029.850169259333,1.7164169487655547,1.5378831724655866,1.9045083845071935,0.00013111888111888112,2.9137529137529138e-05,0.00028409090909090913,0.0,0.0062062937062937066,0.9994826631701632,0.9983388704318937,0.001143792738269478,0.6885632284382442,0.9990308670485388,0.00045179612162438154,0.46618590456882525,66.61599138187283,1,1,1,1
BerkeleyDBC,random,t2,100,97.0,0.037890625,807.2710403509475,0.03811828473405207,97.58280891917332,1.006008339372921,0.8562899669284955,1.0855096360185608,0.00703125,0.002734375,0.01484375,0.0,0.046875,0.98990234375,0.98989898989899,3.353851010023945e-06,0.00033203124999237207,0.9899581061143631,-5.5762364363109995e-05,-0.005552972875252923,25.969225810040033,0,0,0,1
BerkeleyDBC,solverBased,t2,100,97.0,0.037890625,149.52473113347406,0.007060362618297974,18.074528302842815,0.18633534332827645,0.1721577889612615,0.1937201206446174,0.40078125,0.400390625,0.4015625,0.3,0.409765625,0.604609375,0.98989898989899,-0.38528961489898994,-38.14367187500018,0.9501856290262927,-0.34557625402629266,-6.937280292241214,85.63432329000572,0,1,0,1
BerkeleyDBC,divDistBased,t2,100,97.0,0.037890625,682.359208917521,0.03222011111052989,82.48348444295652,0.8503452004428509,0.796061449819739,0.9095865316455287,0.00703125,0.00234375,0.03828125,0.000390625,0.040234375,0.98498828125,0.98989898989899,-0.004910708648989903,-0.48616015625000264,0.9881633669989641,-0.0031750857489640794,-0.26824230747765965,30.570604734137458,0,1,0,1
BerkeleyDBC,twise,t2,100,97.0,0.037890625,229.56563103567132,0.010839789428301385,27.749860936451544,0.2860810405819747,0.2860810405819747,0.2860810405819747,0.05234375,0.05234375,0.05234375,0.05234375,0.05234375,0.94765625,0.98989898989899,-0.04224273989898997,-4.182031250000025,0.9663863974982575,-0.01873014749825752,-0.5572192833923876,87.42386153053708,0,1,0,1
BerkeleyDBC,SRSSampling,t2,100,97.0,0.037890625,2496.8748513919027,0.11789917112507106,301.82187808018193,3.1115657534039376,2.9664288522395763,3.301101940255966,0.00078125,0.0,0.001953125,0.0,0.10234375,0.9933671875,0.98989898989899,0.0034681976010100257,0.3433515624999941,0.996708597793158,-0.0033414102931580425,-1.0151935507037402,8.425565489737036,1,1,1,1
Dune,random,t2,100,265.0,0.1150173611111111,2833668.6680357144,0.11497933962460338,264.9123984950862,0.9996694282833443,0.9839008506170912,1.0147908218664916,0.002170138888888889,0.000759548611111111,0.005750868055555556,0.0,0.025173611111111112,0.9964019097222222,0.9962546816479401,0.00014722807428213525,0.039309895833330014,0.9962534524224493,0.00014845729977286393,0.03962509395647903,8.665921312258183,0,1,0,1
Dune,solverBased,t2,100,265.0,0.1150173611111111,2831388.5451785717,0.1148868210378912,264.6992356713014,0.9988650402690618,0.9419523645932986,1.0960296783178811,0.006944444444444444,0.004340277777777778,0.0078125,0.0,0.03342013888888889,0.9937803819444444,0.9962546816479401,-0.0024742997034956637,-0.6606380208333406,0.996250457945697,-0.002470076001252597,-0.6587673815840844,8.650081645280117,0,0,0,0
Dune,divDistBased,t2,100,265.0,0.1150173611111111,2889979.5523214284,0.1172642180092513,270.17675829331495,1.0195349369559055,0.9917124319489257,1.0421123366868672,0.0026041666666666665,0.0008680555555555555,0.005316840277777778,0.0,0.008246527777777778,0.9969053819444444,0.9962546816479401,0.0006507002965043807,0.17373697916666922,0.9963259170023535,0.0005794649420909348,0.1577168894829331,8.50136042237365,0,0,0,1
Dune,twise,t2,100,265.0,0.1150173611111111,2829079.8889285713,0.11479314467620519,264.48340533397675,0.9980505861659501,0.9980505861659501,0.9980505861659501,0.00390625,0.00390625,0.00390625,0.00390625,0.00390625,0.99609375,0.9962546816479401,-0.00016093164794006576,-0.04296874999999745,0.996247421115222,-0.00015367111522202048,-0.040950802085833404,8.677292993494188,0,1,0,1
Dune,SRSSampling,t2,100,265.0,0.1150173611111111,3060640.405,0.12418897684294941,286.13140264615544,1.0815234856875282,1.0321388970788452,1.140816480093448,0.00043402777777777775,0.0,0.001736111111111111,0.0,0.019965277777777776,0.9986067708333334,0.9962546816479401,0.0023520891853933135,0.6280078125000131,0.9965293612885783,0.0020774095447551044,0.5985669260008072,8.041025831915672,1,1,1,1
Hipacc,random,t2,100,843.0,0.0625139043381535,30129.5795,0.0626030250212179,844.2017924111234,1.0014256137735746,0.9904800252983601,1.0107061884451423,0.0008157211716722285,0.00029662588060808305,0.001557285873192436,0.0,0.006377456433073785,0.9988246199480905,0.9988165680473373,8.051900753147656e-06,0.00680385613640999,0.9988182487806476,6.371167442842385e-06,0.005391293309884549,15.954893866703106,0,1,0,1
Hipacc,solverBased,t2,100,843.0,0.0625139043381535,33812.332500000004,0.07025502289281002,947.388983709543,1.1238303484098968,1.0568885240651804,1.1956474602046199,0.0,0.0,0.00029662588060808305,0.0,0.01260659992584353,0.9993696700037078,0.9988165680473373,0.0005531019563704831,0.46737115313307337,0.9989466909589653,0.000422979044742533,0.40157164541853113,14.224885692920106,1,1,0,0
Hipacc,divDistBased,t2,100,843.0,0.0625139043381535,34140.702,0.07093730669384031,956.5895807664365,1.13474446117015,1.1210547686791874,1.1502149495693723,0.00014831294030404152,7.415647015202076e-05,0.00029662588060808305,0.0,0.001631442343344457,0.9997612161661105,0.9988165680473373,0.0009446481187731504,0.7982276603633379,0.9989568006787635,0.0008044154873469989,0.7711043047780205,14.093588589160838,0,0,1,1
Hipacc,twise,t2,100,843.0,0.0625139043381535,23827.936,0.04950951517965854,667.6358121976955,0.7919760524290576,0.7919760524290576,0.7919760524290576,0.0014089729328883944,0.0014089729328883944,0.0014089729328883944,0.0014089729328883944,0.0014089729328883944,0.9985910270671116,0.9988165680473373,-0.00022554098022575797,-0.19058212829077167,0.9985066509559606,8.437611115097443e-05,0.05650126572066656,20.169678968647872,0,1,0,1
Hipacc,SRSSampling,t2,100,843.0,0.0625139043381535,32990.0155,0.06854641850533846,924.3484535444892,1.0964987586530122,1.075986788037432,1.1160833912230026,0.0002595476455320727,7.415647015202076e-05,0.0005190952910641453,0.0,0.002521319985168706,0.9996277345198369,0.9988165680473373,0.0008111664724995693,0.6854356692621583,0.998920492611421,0.0007072419084158676,0.6551524481428989,14.583223402722126,0,1,0,1
JavaGC,random,t2,100,468.0,0.002418154761904762,37464.94343,0.0024310170213371904,470.4893102415145,1.005319038977595,0.9711764466944468,1.0366444888923378,0.0016844411375661376,0.0007156291335978836,0.0028121383101851853,0.0,0.012710813492063492,0.9977276579034392,0.997872340425532,-0.000144682522092765,-0.06800078538360123,0.9978835500013983,-0.0001558920979590761,-0.07365734983678782,410.4157433478747,0,0,0,0
JavaGC,solverBased,t2,100,468.0,0.002418154761904762,27985.98127333333,0.0018159482066592084,351.45135212399657,0.7509644276153773,0.6164198442976185,0.8702117779811394,0.23812107308201058,0.012297453703703705,0.2707041583994709,0.0,0.4195291832010582,0.8236949198082011,0.997872340425532,-0.17417742061733088,-81.86338769014753,0.9971707563318383,-0.17347583652363718,-61.315268980119775,453.5894343173745,0,0,0,0
JavaGC,divDistBased,t2,100,468.0,0.002418154761904762,37010.14195333333,0.002401505963001503,464.77785805545886,0.9931150813150831,0.9367478964149117,1.0525640864675556,0.0011522404100529102,0.0006303736772486773,0.002896102017195767,3.1001984126984125e-05,0.012829654431216931,0.9979845093419312,0.997872340425532,0.00011216891639920235,0.0527193907076264,0.9978576533082227,0.00012685603370843346,0.05921358769583428,415.5661175600864,0,1,0,1
JavaGC,twise,t2,100,468.0,0.002418154761904762,23296.799633333336,0.0015116776182281656,292.56403952140624,0.6251368365842014,0.6251368365842014,0.6251368365842014,0.00691344246031746,0.00691344246031746,0.00691344246031746,0.00691344246031746,0.00691344246031746,0.9930865575396826,0.997872340425532,-0.00478578288584941,-2.249317956349278,0.9966051524767764,-0.003518594937093833,-1.0364515381099406,656.9433492728941,0,1,0,1
JavaGC,SRSSampling,t2,100,468.0,0.002418154761904762,63514.60941333334,0.004121322026707159,797.6241797607969,1.704325170429053,1.4229966850012272,1.953260828542458,0.0001575934193121693,5.6836970899470896e-05,0.0006704179067460317,0.0,0.006314070767195768,0.9992549706514551,0.997872340425532,0.0013826302259231094,0.6498362061838774,0.9987494125048856,0.0005055581465694958,0.40425651827203113,242.45981366562532,1,1,1,1
LLVM,random,t2,100,56.0,0.0546875,13277.873333333335,0.05473635592552607,56.0500284677387,1.000893365495334,0.9940481207666731,1.0045853162752438,0.01220703125,0.00390625,0.022705078125,0.0,0.072265625,0.983779296875,0.9827586206896551,0.0010206761853448487,0.05919921875000111,0.9827734795934553,0.0010058172815446964,0.05838772182701306,17.973050639569863,0,0,0,0
LLVM,solverBased,t2,100,56.0,0.0546875,12957.056666666667,0.0534138297338186,54.695761647430245,0.9767100294183972,0.9638601587032999,0.9792148622046923,0.0,0.0,0.0,0.0,0.568359375,0.982626953125,0.9827586206896551,-0.00013166756465510243,-0.007636718749995925,0.982361997247367,0.0002649558776330885,0.015021875285371246,18.39648941148394,1,1,0,0
LLVM,divDistBased,t2,100,56.0,0.0546875,13295.458333333334,0.05480884786717865,56.12426021599094,1.0022189324284096,0.9950214720901499,1.008872459297164,0.00390625,0.0009765625,0.0068359375,0.0009765625,0.048828125,0.994873046875,0.9827586206896551,0.012114426185344862,0.7026367187500006,0.9827954799547731,0.012077566920226879,0.7019996424473118,18.151686918979426,0,0,1,1
LLVM,twise,t2,100,55.0,0.0537109375,11935.370000000003,0.04920205548148872,50.38290481304445,0.9160528147826263,0.9160528147826263,0.9160528147826263,0.0126953125,0.0126953125,0.0126953125,0.0126953125,0.0126953125,0.9873046875,0.9824561403508771,0.0048485471491228616,0.2763671875000023,0.9809098024714548,0.0063948850285452385,0.33498265374064773,20.066330112396493,1,1,1,1
LLVM,SRSSampling,t2,100,56.0,0.0546875,13790.108333333334,0.056847980021767774,58.2123315422902,1.0396564302251483,1.03074977878263,1.0465453956715336,0.00390625,0.0009765625,0.0078125,0.0,0.02734375,0.99376953125,0.9827586206896551,0.011010910560344866,0.638632812500001,0.9833921063279596,0.010377424922040412,0.6248489499611221,17.48117577562956,0,0,0,0
Polly,random,t2,100,345.0,0.00575,9306.265833333335,0.005742507543456659,344.55045260739956,0.998696964079419,0.9893433456468953,1.0105653182047958,0.0018416666666666668,0.0010166666666666666,0.0037166666666666667,6.666666666666667e-05,0.013416666666666667,0.9971475,0.9971181556195965,2.9344380403473203e-05,0.010182500000005023,0.9971144172732249,3.3082726775046645e-05,0.011464833937379362,173.64321987460107,0,0,0,1
Polly,solverBased,t2,100,345.0,0.00575,9391.843333333334,0.005795313840644082,347.71883043864494,1.0078806679381014,0.9922569334446603,1.0230661122597549,0.00225,0.0018666666666666666,0.00225,0.00016666666666666666,0.010266666666666667,0.997237,0.9971181556195965,0.00011884438040354883,0.04123900000003072,0.9971405600357701,9.643996422992185e-05,0.03372687149803319,172.07644442068192,0,0,0,1
Polly,divDistBased,t2,100,345.0,0.00575,9204.230833333333,0.005679546011120255,340.77276066721527,0.9877471323687399,0.9609057718533732,1.0002106346461768,0.0013916666666666667,0.0006333333333333333,0.0028625,5e-05,0.018266666666666667,0.9969846666666666,0.9971181556195965,-0.00013348895292986107,-0.04632066666666098,0.9970826153220184,-9.79486553517317e-05,-0.03357413099855465,175.53949993795678,1,1,0,1
Polly,twise,t2,100,345.0,0.00575,6698.91,0.004133617274304588,248.01703645827527,0.718889960748624,0.718889960748624,0.718889960748624,0.004416666666666667,0.004416666666666667,0.004416666666666667,0.004416666666666667,0.004416666666666667,0.9955833333333334,0.9971181556195965,-0.0015348222862631156,-0.5325833333332918,0.9960002725647582,-0.0004169392314248288,-0.10424191102402545,240.8503901708761,0,1,0,1
Polly,SRSSampling,t2,100,345.0,0.00575,9465.911666666667,0.005841018312288815,350.46109873732894,1.0158292717024027,1.0054941730341374,1.0260967175416624,0.0016,0.00048333333333333334,0.0026875,0.0,0.01105,0.9977743333333333,0.9971181556195965,0.0006561777137368274,0.22769366666667512,0.9971628074599369,0.0006115258733964124,0.21553908124360613,170.82198342609772,0,0,1,1

repro-fse2026/codex/artifacts/fse_posterior_fse_artifact_all/BerkeleyDBC/BerkeleyDBC_fse_posterior_report.md

## Headline

Lowest median posterior risk: `SRSSampling_t2` (risk 0.0007813, %cost 0.1179).

Best integrated confidence after normalizing the prior baseline by empirical cost: `random_t2` (omega_cost -5.576e-05, %cost 0.03812).

- `random_t2`: posterior area 0.9899, risk 0.007031, %cost 0.03812, omega_cost -5.576e-05
- `solverBased_t2`: posterior area 0.6046, risk 0.4008, %cost 0.00706, omega_cost -0.3456
- `divDistBased_t2`: posterior area 0.985, risk 0.007031, %cost 0.03222, omega_cost -0.003175
- `twise_t2`: posterior area 0.9477, risk 0.05234, %cost 0.01084, omega_cost -0.01873
- `SRSSampling_t2`: posterior area 0.9934, risk 0.0007813, %cost 0.1179, omega_cost -0.003341